160,Pineau et al. (2016),2016,Executive functioning and risk-taking behavior in Parkinson's disease patients with impulse control disorders,"(a) 17 PwP+ICB (14 male), 55 (37-69). UPDRS 7 (0-23), duration 7 years (2-10). (b) 20 PwP-ICB (14 male), 55 (40-62). UPDRS 8.5 (0-34), duration 5.5 years (4-12). (c) 15 HC.","Barratt Impulsiveness Scale (impulsivity), Conner’s Performance Test (inhibition), Trail Making Test (shifting and reactive flexibility), modified Iowa Gambling Task","BIS higher in PwP+ICB than PwP-ICB group. No differences in TMT B-A scores, or commission errors on CPT. PwP+ICB and PwP-ICB chose the losing deck (higher amounts of money) more frequently than the neutral deck, and the winning deck (smaller amounts of money). PwP+ICB and PwP-ICB chose the winning deck significantly less than the HC group, but no differences for losing deck. PwP+ICB evaluated the winning deck as the loser deck more frequently than both the PwP-ICB and HC groups (more sensitive to reward than punishment?). No info available on HC group, but says they were matched by age, sex, and educational level.",yes,yes,no,no,1,,,1,,,,1,,,,,,,,,,,,,,,,,,,,,,,,,,,,,,,,,,,,,,,,,,,,,,1,,,,,,,,,,,,,,,,,,,,,,,,,,,,,,,,,,,,,,,,,,,,,
161,Plessow et al. (2014) ,2014,Subthalamic deep brain stimulation restores automatic response activation and increases susceptibility to impulsive behavior in patients with Parkinson's disease,"(a) 13 PwP (11 male), 64.41 (6.59). UPDRS ON STN-DBS 16.31 (8.38), UPDRS OFF STN-DBS 38.15 (17.88), duration 17 years (6.03). (b) 26 HC (13 male), 65.08 (8.14).","Interference task (spatial-compatibility). Also: OFF medication, STN-DBS ON/OFF.","Larger spatial compatibility effect (for reaction time, not errors) when DBS was ON versus DBS was OFF. No differences in spatial compatibility effects (reaction time and errors) between HCs and PwP (whether DBS ON or OFF). Automatic response activation processes, and not inhibitory control processes, are affected by the basal ganglia in PwP.",yes,no,no,yes,,,,,,,1,,,,,,,,,,,,,,,,,,,,,,,,,,,,,,,,,,,,,,,,,,,,,,,,,,,,,,,,,,,,,,,,,,,,,,,,,,,,,,,,,,,,,,,,,,,,
162,Poletti et al. (2010),2010,Decision Making in De Novo Parkinson's Disease,"(a) 30 de novo PwP (22 male), 64.9 (5.8). UPDRS 14.3 (8.1). (b) 25 HC (14 male), 65.4 (2.2).",Iowa Gambling Task (decision making).,No differences in total score for IGT between de novo PwP and HC. Both groups learned to pick advantageously over time. IGT score not related to motor subtype (tremor dominant vs postural instability and gait dominance) or BIS total score.,yes,no,no,no,,,,,,,,1,,,,,,,,,,,,,,,,,,,,,,,,,,,,,,,,,,,,,,,,,,,,,,,,,,,,,,,,,,,,,,,,,,,,,,,,,,,,,,,,,,,,,,,,,,,
163,Poletti et al. (2011),2011,Alexithymia may modulate decision making in patients with de novo Parkinson's disease,"(a) 12 de novo PwP with alexithymia (10 male), 63.92 (7.17). (b) 12 de novo PwP without alexithymia (7 male), 66.17 (5.20).",Iowa Gambling Task (decision making under uncertainty).,"No differences in IGT total score between groups. Both groups learned to pick advantageously over time, but alexythymic patients learned to do this faster.",no,no,yes,no,,,,,,,,1,,,,,,,,,,,,,,,,,,,,,,,,,,,,,,,,,,,,,,,,,,,,,,,,,,,,,,,,,,,,,,,,,,,,,,,,,,,,,,,,,,,,,,,,,,,
164,Poliakoff et al. (2003),2003,Orienting of attention and Parkinson's disease: Tactile inhibition of return and response inhibition,"(a) 24 PwP (19 male), 62.6 (8.4). UPDRS 18.2 (5.1). (b) 24 HC (13 male), 65 (7).",Tactile Inhibition of Return.,"The PwP group showed a significant IOR effect in the cue-target condition, but not the target-target condition. HCs showed a larger magnitude of the IOR effect compared to the PwP group.",yes,no,no,no,,,,,,,,,,,,,,,,,,,,,,,,,,,,,,,,,,,,,,,,,,,,1,,,,,,,,,,,,,,,,,,,,,,,,,,,,,,,,,,,,,,,,,,,,,,,,,,,,,,,
165,Pollux & Robinson (2002) ,2002,Reduced task-set inertia in Parkinson's disease,"(a) 13 PwP (6 male), 63.3 (9.4). H&Y 2 (1-3), duration 8 years (2-39). (b) 16 HC (8 male), 62.2 (7.4).","Alternating Stroop Switching Task (task-set inertia, set-maintenance, cognitive inhibition).","Interference effect (RT) significantly greater in PwP than HCs. Both groups had significantly longer response times for alternating lists than baseline, but did not differ between groups. Age of onset was not correlated with Stroop interference or switch costs.",yes,no,no,no,,1,,,,,,,,,,,,,,,,,,,,,,,,,,,,,,,,,,,,,,,,,,,,,,,,,,,,,,,,,,,,,,,,,,,,,,,,,,,,,,,,,,,,,,,,,,,,,,,,,
166,Possin et al. (2009),2009,Space-based but not object-based inhibition of return is impaired in Parkinson's disease,"(a) 18 PwP (11 male). H&Y 2.12 (0.57), UPDRS 23.22 (11.73). (b) 18 HC (9 male).",Inhibition of Return,Object-based: No difference in IOR magnitude between HCs and PwP. Space-based: PwP demonstrated significantly smaller IOR effects (near zero) than HC.,yes,no,no,no,,,,,,,,,,,,,,,,,,,,,,,,,,,,,,,,,,,,,,,,,,,,1,,,,,,,,,,,,,,,,,,,,,,,,,,,,,,,,,,,,,,,,,,,,,,,,,,,,,,,
167,Pote et al. (2016),2016,Subthalamic nucleus deep brain stimulation induces impulsive action when patients with Parkinson's disease act under speed pressure,"(a) 12 PwP (10 male), 56.75 (5.36). UPDRS ON STN-DBS 30.5 (8.34), UPDRS OFF STN-DBS 69.42 (21.03), H&Y ON 2.08 (0.29), H&Y OFF 2.92 (1.24), duration 12.58 years (3.55). (b) 12 HC (9 male), 60.67 (10.58).",Moving Dots Task (impulsivity). Also: STN-DBS ON/OFF.,"Under speed instructions PwP patients were faster ON than OFF STN-DBS, but under accuracy instructions RTs did not change significantly. For the HCs the RTs did not change between the instructions given. PwP patients made more errors than HCs and these were more frequent under speed instructions, especially with STN-DBS ON. PwP patients had a higher response threshold than HCs, and thus responded more cautiously. The threshold was also higher with STN-DBS OFF compared to when it was ON, and changed more significantly under speed instructions than accuracy. STN-DBS caused a decrease in levels of caution (evidenced by lowering of response threshold), i.e. higher impulsive action under speed pressure.",yes,no,no,yes,,,,,,,,,,,,,,,,,,,,,,,,,,,,,,,,,,,,,,,,,,,,,,,,,,,,1,,,,,,,,,,,,,,,,,,,,,,,,,,,,,,,,,,,,,,,,,,,,,,,
168,Praamstra & Plat (2001) ,2001,Failed suppression of direct visuomotor activation in Parkinson's disease,"(a) 8 PwP (8 male), 58 (8). UPDRS OFF medication 37 (9), H&Y 2-3, duration 5.75 years (2.71). (b) 8 HC (8 male), 57 (5).",Simon task (response inhibition/attention). Also: EEG.,PwP showed less inhibitory control than HC for error rates but not RT,yes,no,no,no,,,,,,,1,,,,,,,,,,,,,,,,,,,,,,,,,,,,,,,,,,,,,,,,,,,,,,,,,,,,,,,,,,,,,,,,,,,,,,,,,,,,,,,,,,,,,,,,,,,,
169,Price (2010) ,2010,Contextual cues remediate problem solving: Deficits in Parkinson's disease,"(a) 15 PwP (10 male), 67.67 (1.42). H&Y 1-3. (b) 12 HC (8 male), 64.2 (1.67).","Anagram Task (self-directed cognitive flexibility), Stroop task (inhibitory control).","No significant differences for RT interference between PwP and HC on Stroop task. PwP and HC similar proportion correct and similar RTs on anagram task in cued condition (some blanks filled in), but PwP significantly worse (proportion correct and RTs) in baseline condition (no cues). Stroop inhibitory control proficiency correlated with faster baseline RTs on anagram task.",yes,no,no,no,,1,,,,,,,,,,,,,,,,,,,,,,,,,,,,,,,,,,,,,,,,,,,,,,,,,,,,,,,,,,,,,,,,,,,,1,,,,,,,,,,,,,,,,,,,,,,,,,,,,,
170,Rajan et al. (2018),2018,Dopamine Receptor D3 rs6280 is Associated with Aberrant Decision-Making in Parkinson's Disease,"(a) 45 PwP with genotype status CT/CC. (b) 33 PwP with genotype status TT. (NB: No additional participant info available, but they did not significantly differ in gender, age of onset, past ICB, dopamine agonist use, and total LEDD).",Iowa Gambling Task (decision making under ambiguous risk),"No difference between DRD3 rs6280 groups for total IGT score, or IGT block scores. TT group chose equally from all decks whereas CT/CC group showed a skewed preference for choosing deck A (disadvantageous), C (advantageous), and D (advantageous) over deck B (disadvantageous). CT/CC group demonstrated loss aversion. ",no,no,yes,no,,,,,,,,1,,,,,,,,,,,,,,,,,,,,,,,,,,,,,,,,,,,,,,,,,,,,,,,,,,,,,,,,,,,,,,,,,,,,,,,,,,,,,,,,,,,,,,,,,,,
171,Ranchet et al. (2013) ,2013,Impact of Specific Executive Functions on Driving Performance in People With Parkinson's Disease,"(a) 19 PwP (17 male), 66.1 (5.1). UPDRS 16.4 (4.8), H&Y 2.1 (0.3), duration 7.5 years (4.3). (b) 21 HC (17 male), 69.1 (3.9).","Stroop test (inhibition), Trail Making Test (global executive function)",PwP showed a greater interference effect on Stroop than HC. No differences on Trail Making Test B-A.,yes,no,no,no,,1,,1,,,,,,,,,,,,,,,,,,,,,,,,,,,,,,,,,,,,,,,,,,,,,,,,,,,,,,,,,,,,,,,,,,,,,,,,,,,,,,,,,,,,,,,,,,,,,,,
172,Rao et al. (2010),2010,Decreased Ventral Striatal Activity with Impulse Control Disorders in Parkinson's Disease,"(a) 9 PwP+ICB (7 male), 56.2 (10.7). H&Y 2.1 (0.3), duration 7.2 years (4.4). (b) 9 PwP-ICB (8 male), 54.5 (9.6). H&Y 2.1 (0.2), duration 7.6 years (6.6).",Balloon Analogue Risk Task (risk taking). Also: fMRI.,"No differences in adjusted pumps (or any other measure for BART) between PwP+ICB and PwP-ICB. Resting perfusion: no differences in global cerebral blood flow but PwP+ICB group showed reduced CBF in ventral striatum. PwP+ICB group had reduced activation in ventral striatum during risk taking, but no differences relating to win or loss outcomes (and this overlapped with resting perfusion).",no,yes,no,no,,,,,,,,,1,,,,,,,,,,,,,,,,,,,,,,,,,,,,,,,,,,,,,,,,,,,,,,,,,,,,,,,,,,,,,,,,,,,,,,,,,,,,,,,,,,,,,,,,,,
173,Ray et al. (2009) ,2009,The role of the subthalamic nucleus in response inhibition: Evidence from deep brain stimulation for Parkinson's disease,(a) 10? PwP. (b) 10 HC.,Stop Signal task (response inhibition). Also: STN-DBS ON/OFF.,"STN-DBS impaired response inhibition in PwP but only if their baseline performance was similar to HCs. STN-DBS of the right side of the body had no effect on response inhibition, but on the left side it impaired response inhibition.",yes,no,no,yes,,,,,1,,,,,,,,,,,,,,,,,,,,,,,,,,,,,,,,,,,,,,,,,,,,,,,,,,,,,,,,,,,,,,,,,,,,,,,,,,,,,,,,,,,,,,,,,,,,,,
174,Ray et al. (2012) ,2012,Extrastriatal dopaminergic abnormalities of DA homeostasis in Parkinson's patients with medication-induced pathological gambling: A [11C] FLB-457 and PET study,"(a) 7 PwP+PG, 59.71 (10.98). UPDRS 21 (8.04), duration 10.43 years (5.53). (b) 7 PwP-PG, 60.57 (9.73). UPDRS 17.14 (6.44), duration 8.14 years (4.53).",Barratt Impulsiveness Scale (trait impulsivity),Total BIS higher in PwP+PG than PwP-PG.,no,yes,no,no,1,,,,,,,,,,,,,,,,,,,,,,,,,,,,,,,,,,,,,,,,,,,,,,,,,,,,,,,,,,,,,,,,,,,,,,,,,,,,,,,,,,,,,,,,,,,,,,,,,,
175,Ricciardi et al. (2017),2017,Acting without being in control: Exploring volition in Parkinson's disease with impulsive compulsive behaviours,"(a) 19 PwP+ICB (12 male), 53.6 (9.3). UPDRS 15.4 (7.3), H&Y 1.6 (0.5), duration 7.8 years (4.1). (b) 19 PwP-ICB (11 male), 56.9 (8.4). UPDRS 12.2 (7.4), H&Y 1.5 (0.4), duration 5.4 years (2.5). (c) 19 HC (8 male), 52.6 (7.4).","Intentional binding task (sense of agency), Stop Signal Task (reactive inhibition), Marble task (intentional inhibition), Balloon Analogue Risk Task (reward sensitivity), Trail Making Test (executive functioning)","Significant main effect of group on SSRT (impaired in PwP-ICB compared to HC) but no differences between PwP+ICB and PwP-ICB. No significant differences between groups on Marble task. No significant differences between groups on BART (risk adjustment – learning which colour balloon which riskier, and difference between inflation on low and high risk balloons). No significant differences between groups on TMT-B, but PwP (think this includes both PwP+ICB and PwP-ICB?) were slower than HC for TMT-A. Conclusion: No differences between PwP+ICB and PwP-ICB on any task and PwP-ICB worse than HC for SSRT only.",yes,yes,no,no,,,,1,1,,,,1,,,,,,,,,,,,,,,,,,,,,,,,,,,,,,,,,,,,,,,,,,,,,,,,,,,,,,,,,,,,,,,,,,,,,,,,,,,,,,,,,,,,1,,,,,,
176,Richards et al. (1993) ,1993,Executive function in Parkinson's disease: Set-shifting or set-maintenance?,"(a) 18 PwP, 67.6 (5.1). H&Y 2.5 (0.7), duration 7.6 years (5.8). (b) 13 HC, 69 (3.5).","Stroop task (perceptual interference), Odd Man Out test (set shifting)","Worse total score for PwP than HC, even when only including switch trials only. Disruption of the first switch was more pronounced in PwP than HC, and even though both groups recovered to begin with the HCs recovered a lot better. No differences in interference effects on Stroop task.",yes,no,no,no,,1,,,,,,,,,,,,,,,,,,,,,,,,,,,,1,,,,,,,,,,,,,,,,,,,,,,,,,,,,,,,,,,,,,,,,,,,,,,,,,,,,,,,,,,,,,,,,,,,,,
177,Rivaud-Pechoux et al. (2007) ,2007,Mixing pro- and anti-saccades in patients with Parkinsonian syndromes,(a) 15 PwP. (b) 8 corticobasal degeneration patients. (c) 12 progressive supranuclear palsy patients. (d) 10 HC.,"Pro-saccade task, Anti-saccade task, Mixed pro-saccade and anti-saccade task.","No difference in inhibitory control (accuracy and RT) between PwP and HC when anti-saccade task performed separately. PwP worse when pro- and anti-saccade trials are mixed for accuracy, but not RT. When pro-saccade and anti-saccade tasks are mixed in a Go/No-Go type paradigm, inhibitory control in PwP is significantly reduced compared to HC.",yes,no,no,no,,,,,,,,,,,,,,,,,,,,,,,,,,,,,,,,,,,,,,1,,,,,,,,,,,,,,,,,,,,,,,,,,,,,,,,,,,,,,,,,,,,,,,,,,,,,,,,,,,,,
178,Rogers et al. (1998),1998,Dissociating executive mechanisms of task control following frontal lobe damage and Parkinson's disease,"(a) 12 PwP (6 male), 59.2 (1.8). H&Y 1.2 (0.1), duration 2.4 years (0.3). (b) 12 HC (5 male), 58.8 (1.8).",Task switching paradigm (task switching),"PwP showed reduced switch costs (and HC showed switch benefit) when cue was a word rather than a colour. Both PwP and HC showed greater switch costs in crosstalk versus no crosstalk conditions. RTs and error rates higher for PwP and HC when irrelevant character was task-associated rather than neutral, but no differences between groups. No differences in ability to un-inhibit previously inhibited task-associated character between PwP and HCs. No direct comparisons between HC and PwP for some.",yes,no,no,no,,,,,,,,,,,,,,,,,,,,,,,,,,,,1,,,,,,,,,,,,,,,,,,,,,,,,,,,,,,,,,,,,,,,,,,,,,,,,,,,,,,,,,,,,,,,,,,,,,,,
179,Rogers et al. (2011),2011,Deep brain stimulation of the subthalamic nucleus transiently enhances loss-chasing behaviour in patients with Parkinson's Disease,"22 PwP (10 male), 65.55 (1.72). H&Y 1-3.",Gambling task (loss chasing). Also: STN-DBS ON/OFF.,No relevant stats available for proportionate choice or value of losses. No significant differences between STN-DBS OFF and ON for mean deliberation times for deciding to chases losses or quit. Behavioural results have some missing info.,no,no,no,yes,,,,,,,,,,,,,,,,,,,,,,,,,,,,,,,,,,,1,,,,,,,,,,,,,,,,,,,,,,,,,,,,,,,,,,,,,,,,,,,,,,,,,,,,,,,,,,,,,,,,
180,Rosa et al. (2013),2013,Pathological Gambling in Parkinson's Disease: Subthalamic Oscillations During Economics Decisions,"(a) 8 PwP+PG (6 male), 57 (11.9). Duration 11 years (4.86). (b) 9 PwP-PG (3 male), 61 (6.07). Duration 10 years (2.77).",Economics task (decision making). Also: EEG.,"(a) PwP+PG patients used a risky strategy, whereas PwP-PG did not. (b) No differences in performance between groups on trials requiring a risky decision and trials not requiring a risky decision. (c) Higher changes in low frequency power in STN when viewing trials requiring a risky decision than trials not requiring a risky decision.",no,yes,no,no,,,,,,,,,,,,,,,,,1,,,,,,,,,,,,,,,,,,,,,,,,,,,,,,,,,,,,,,,,,,,,,,,,,,,,,,,,,,,,,,,,,,,,,,,,,,,,,,,,,,
181,Rossi et al. (2010),2010,Decision-making in Parkinson's disease patients with and without pathological gambling,"(a) 7 PwP+PG (6 male), 61.4 (6.9). UPDRS 17 (9.1), H&Y 2.2 (0.7). (b) 13 PwP-PG (10 male), 65.1 (3.8). UPDRS 14.7 (6.7), H&Y 2.0 (0.7).","Stroop task (executive functioning), Zuckerman-Kuhlman Personality Questionnaire (sensation seeking), Go/No-Go (response inhibition), Iowa Gambling Task (decision making under ambiguity), Game of Dice Task (decision making under risk), Investment Task (decision making under risk).","PwP+PG selected more disadvantageously than PwP-PG for deck B (bad deck, higher immediate gains) only, and as time went on PwP+PG group didn’t develop better strategy whereas PwP-PG did. Pathological gambling affects decision making under ambiguity but not risk. No group differences for GoD, Investment task, Stroop, Go/No-Go, or Zuckerman-Kuhlman Personality Questionnaire. No group differences for Stroop (switching, and inhibition based on number of correct words within 45 seconds and number of errors)",no,yes,no,no,,1,1,,,,,1,,,,,,1,,,,,,,,,,,,1,,,,,,,,,,,,,,,,,,,,,,,,,,,,,,,,,,,,,,,,,,,,,,,,,,,,,,1,,,,,,,,,,,,,,,,,,,
182,Ruitenberg et al. (2018),2018,Impulsivity in Parkinson's disease is associated with alterations in affective and sensorimotor striatal networks,"(a) 21 PwP+ICB (14 male), 60 (5). UPDRS 25.95 (9.92), duration 57.3 months (30.7). (b) 30 PwP-ICB (19 male), 62 (8). UPDRS 25.33 (9.49), duration 44.2 months (37.7).","Beads task, Barratt Impulsiveness Scale","PwP+ICB group had higher total BIS scores and higher motor scores than PwP-ICB, but no significant differences for attentional or non-planning impulsivity. No significant differences between groups for number of beads drawn on 80/20 and 60/40 trials, or for $10 and $0 loss trials. Participants similarly drew more beads for 60/40 trials and $10 loss trials, and more frequently chose the correct jar for 80/20 trials. Higher BIS scores were related to reduced connectivity between the left putamen and various frontal, temporal, and cerebellar areas, between the left caudate and temporal areas, and between the left STN and frontal areas. There was a negative association between the average number of draw choices and grey matter volume in the putamen, i.e. patients who made more draw choices (less impulsivity) exhibited a smaller putamen GM value than those who collected less evidence.",no,yes,no,no,1,,,,,,,,,,,,,,,,,,,,,,,,,,,,,,,,1,,,,,,,,,,,,,,,,,,,,,,,,,,,,,,,,,,,,,,,,,,,,,,,,,,,,,,,,,,,,,,,,,,
183,Sáez-Francàs et al. (2014) ,2014,Relationship between poor decision-making process and fatigue perception in Parkinson's disease patients,"(a) 33 fatigued PwP (20 male), 61.73 (9.85). UPDRS 30.85, H&Y 2 (0.57), duration 59.30 (41.33) months. (b) 56 non-fatigued PwP (38 male), 62.64 (9.06). UPDRS 18.41 (5.82), H&Y 1.81 (0.58), duration 51.66 (43.78) months.","Trail Making Test (response inhibition), Stroop task (cognitive flexibility/response inhibition), Iowa Gambling Task (decision making).","No differences between fatigued and non-fatigued PwP patients on Trail Making Test B-A or Stroop task performance. Fatigued PwP patients made poorer decisions on the Iowa Gambling Task than non-fatigued PwP patients, particularly in later trials when the rules should have been more explicit.",no,no,yes,no,,1,,1,,,,1,,,,,,,,,,,,,,,,,,,,,,,,,,,,,,,,,,,,,,,,,,,,,,,,,,,,,,,,,,,,,,,,,,,,,,,,,,,,,,,,,,,,,,,,,,,
184,Santangelo et al. (2018),2018,Cognitive correlates of “pure apathy” in Parkinson's disease,"(a) 28 PwP+apathy, 68.3 (8.7). UPDRS 16.7 (7.8), H&Y 2.5 (0.6), duration 7.7 years (3.4). (b) 28 PwP-apathy, 64.6 (7.6). UPDRS 14.8 (6.7), H&Y 2.2 (0.7), duration 8.6 (4).","Trail Making Test (executive functioning/shifting ability), Stroop (interference/inhibitory control).","PwP+apathy performed worse for B-A on TMT, and interference on the Stroop test.",no,no,yes,no,,1,,1,,,,,,,,,,,,,,,,,,,,,,,,,,,,,,,,,,,,,,,,,,,,,,,,,,,,,,,,,,,,,,,,,,,,,,,,,,,,,,,,,,,,,,,,,,,,,,,
185,Sauvaget et al. (2017),2017,A Comparison of Treatment-Seeking Behavioral Addiction Patients with and without Parkinson's Disease,"(a) 32 PwP with behavioural addictions (32 male), 61.7 (6.94). Duration 7.7 years (5.5). (b) 2428 HC with behavioural addictions (2428 male), 41.5 (13.4).","Temperament and Character Inventory (personality), Barratt Impulsiveness Scale (impulsivity).","HCs scored higher on the attentional, non-planning, and total scores on the BIS compared to PwP. PwP scored higher for reward dependence on the TCI than HCs. No significant differences for motor impulsivity (BIS) or novelty seeking and harm avoidance (TCI).",yes,no,no,no,,,,,,,,,,,,,,,,,,,,,,,,,,,,,,,,,,,,,,,,,,,,,,,,,,,,,,,,,,,,,,,,,,,,,,,,,,,,,,,,,,,,,,,,,,,,,,,,,,,
186,Seinstra et al. (2016) ,2016,No Effect of Subthalamic Deep Brain Stimulation on Intertemporal Decision-Making in Parkinson Patients,(a) 8 PwP ON medication and ON STN-DBS. (b) 7 PwP ON medication and OFF STN-DBS. (c) 10 PwP OFF medication and ON STN-DBS. (d) 7 PwP OFF medication and OFF STN-DBS.,"Intertemporal Choice task (delay discounting), Barratt Impulsiveness Scale (impulsivity), Quick Delay Questionnaire (delay discounting), Holt-Laury task (risk attitude).",There were no significant differences ON/OFF medication or STN-DBS for delay discounting. Lower BIS total scores when ON STN-DBS compared to OFF but only when ON medication.,no,no,,,1,,,,,1,,,,,,,,,,,,,,,,,,,,,,,,,,,,,,,,,,,,,,,,,,,,,,,,,,,,,,1,,,,,,,,,,,,,,,,,,,,,,,,,,,,,,,,,,,,,,,
187,Seiss & Praamstra (2004),2004,The basal ganglia and inhibitory mechanisms in response selection: Evidence from subliminal priming of motor responses in Parkinson's disease,"(a) 12 PwP (9 male), 60 (8). UPDRS OFF medication 29 (24-36). (b) 12 HCs (9 male), 58 (7).","Masked Priming Compatibility task (response selection). Also: medication OFF, EEG.","Similar RT compatibility effect but more compatibility errors in PwP than HCs at shorter (0ms) ISI. A reduced negative compatibility effect (i.e. a positive compatibility effect) in PwP and HCs at longer ISI (100ms), but significantly more reduced in PwP. Suggested reduced inhibition in PwP. More positive compatibility effect at longer ISI correlated positively with disease severity.",yes,no,no,no,,,,,,,,,,,,,,,,,,,,,,,,,,,,,,,,,,,,,,,,,,,,,,,,,,,,,,,,,,,,,,,,,,,,,,,,,,,,,,,,,1,,,,,,,,,,,,,,,,,,
188,Seiss & Praamstra (2006) ,2006,Time-course of masked response priming and inhibition in Parkinson's disease,"(a) 11 PwP (7 male), 54 (7). UPDRS OFF medication 23 (8-33). (b) 11 HC (9 male), 53.6 (4.9).",Masked Priming Compatibility Task. Also: medication OFF.,Larger RT and error compatibility effects in PwP compared to HCs. The compatibility effect decreased with longer ISIs similarly for both PwP and HCs which suggests there aren’t any deficit inhibitory processes.,yes,no,no,no,,,,,,,,,,,,,,,,,,,,,,,,,,,,,,,,,,,,,,,,,,,,,,,,,,,,,,,,,,,,,,,,,,,,,,,,,,,,,,,,,1,,,,,,,,,,,,,,,,,,
189,Seymour et al. (2016) ,2016,Deep brain stimulation of the subthalamic nucleus modulates sensitivity to decision outcome value in Parkinson's disease,"(a) 22 STN-DBS PwP (18 male), 55 (7.5). UPDRS ON 16.91, UPDRS OFF 35.55, H&Y 1-3.","Instrumental Learning of Reward and Punishment, Inter-temporal choice task (temporal discounting). Also: STN-DBS ON/OFF.","Performed worse (lower winnings) when ON compared to OFF. DBS-OFF more likely to switch choices after punishment than DBS-ON, but no differences for reward. Reduction in sensitivity to both reward and punishment when DBS was ON. Learning rates not altered when ON versus OFF. No differences in frequency of choosing sooner options when ON or OFF.",no,no,no,yes,,,,,,1,,,,,,,,,,,,,,,,,,,,,,,,,,,,,,,,,,,,,,,,,,,,,,,,,,,,1,,,,,,,,,,,,,,,,,,,,,,,,,,,,,,,,,,,,,,,,,
190,Sharp et al. (2013),2013,Decisions under risk in Parkinson's disease: Preserved evaluation of probability and magnitude,"(a) 18 PwP (13 male), 65.47  (9.17). UPDRS 20.65 (6.91), H&Y 1.97 (0.65). (b) 18 HC (9 male), 66.76 (5.83).","Vancouver Gambling Task (decision making under risk), Temperament and Character Inventory (novelty seeking). Also: Medication ON/OFF.","No differences in novelty seeking scores. No differences between PwP and HC, whether ON or OFF meds, in the gain phase. In loss phase, PwP patients OFF meds more likely to avoid decisions with larger loss than HCs. No difference between HCs and PwP ON meds. No difference in gain or loss performance ON/OFF meds.",yes,no,no,yes,,,,,,,,,,1,,,,,,,,,,,,,,1,,,,,,,,,,,,,,,,,,,,,,,,,,,,,,,,,,,,,,,,,,,,,,,,,,,,,,,,,,,,,,,,,,,,,,,,,,,
191,Siegert et al. (2014) ,2014,Error signals in the subthalamic nucleus are related to post-error slowing in patients with Parkinson's disease,"(a) 17 advanced PwP post-operative STN-DBS (12 male), 57 (12).","Speeded flanker task. Also: Medication ON/OFF, EEG.","No difference in interference effects, post-error slowing, or error corrections ON vs OFF meds. No difference in ERPs for compatible/incompatible trials for ON vs OFF meds. Significant differences for STN-ERPs between correct and incorrect incompatible trials, but no effect of ON/OFF meds.",no,no,no,yes,,,,,,,,,,,1,,,,,,,,,,,,,,,,,,,,,,,,,,,,,,,,,,,,,,,,,,,,,,,,,,,,,,,,,,,,,,,,,,,,,,,,,,,,,,,,,,,,,,,,
